{
  "schema_version": 2,
  "lesson_id": "LES.mul.prep.multiple_for",
  "support_language_tag": "tr",
  "proficiency_band": "all",
  "register": "plain",
  "title": "Diller bu ilişkileri nasıl ifade eder",
  "invitation": "Dillerin bu ilişkileri nasıl ifade ettiğini karşılaştır.",
  "summary": "Türkçede farklı ekler, edatlar ve yapılar cümlede farklı görevler üstlenebilir. Amaç, neden, varış yeri, alıcı, değiş tokuş veya zaman gibi ilişkileri ifade edebilirler. Türkçe bu görevleri birden fazla biçim arasında paylaştırır; bazı diller bunların birçoğu için tek bir biçim kullanırken, bazıları birden fazla biçim kullanır:",
  "blocks": [],
  "review_state": "candidate",
  "version": 1
}
