{
  "schema_version": 2,
  "lesson_id": "LES.mul.prep.multiple_for",
  "support_language_tag": "zh-Hant",
  "proficiency_band": "all",
  "register": "plain",
  "title": "不同語言如何表達這些關係",
  "invitation": "比較不同語言如何表達這些關係。",
  "summary": "在中文裡，不同的介詞、介詞性結構和其他表達可以在句子中承擔不同的作用。它們可以表示目的、原因、目的地、接收者、交換或時間等關係。中文會用多種形式來表達這些關係；有些語言用一種形式涵蓋其中很多關係，而另一些語言則使用多種形式：",
  "blocks": [],
  "review_state": "candidate",
  "version": 1
}
